question,document_title,document_url,long_answer_text,short_answers
what purpose did seasonal monsoon winds have on trade,Trade winds,https://en.wikipedia.org//w/index.php?title=Trade_winds&oldid=817251427,"The trade winds are the prevailing pattern of easterly surface winds found in the tropics , within the lower portion of the Earth's atmosphere , in the lower section of the troposphere near the Earth's equator . The trade winds blow predominantly from the northeast in the Northern Hemisphere and from the southeast in the Southern Hemisphere , strengthening during the winter and when the Arctic oscillation is in its warm phase. Trade winds have been used by captains of sailing ships to cross the world's oceans for centuries, and enabled European empire expansion into the Americas and trade routes to become established across the Atlantic and Pacific oceans .",
who got the first nobel prize in physics,List of Nobel laureates in Physics,https://en.wikipedia.org//w/index.php?title=List_of_Nobel_laureates_in_Physics&oldid=838175212,"The first Nobel Prize in Physics was awarded in 1901 to Wilhelm Conrad Röntgen , of Germany, who received 150,782 SEK , which is equal to 7,731,004 SEK in December 2007. John Bardeen is the only laureate to win the prize twice—in 1956 and 1972. Maria Skłodowska-Curie also won two Nobel Prizes, for physics in 1903 and chemistry in 1911. William Lawrence Bragg was, until October 2014, the youngest ever Nobel laureate; he won the prize in 1915 at the age of 25. Two women have won the prize: Curie and Maria Goeppert-Mayer (1963). As of 2017, the prize has been awarded to 206 individuals. There have been six years in which the Nobel Prize in Physics was not awarded (1916, 1931, 1934, 1940–1942).","Wilhelm Conrad Röntgen , of Germany"
when is the next deadpool movie being released,Deadpool 2,https://en.wikipedia.org//w/index.php?title=Deadpool_2&oldid=838535646,"Deadpool 2 is scheduled to be released in the United States on May 18, 2018. A sequel, Deadpool 3 , is in development.","May 18, 2018"
where did the idea of fortnite come from,Fortnite,https://en.wikipedia.org//w/index.php?title=Fortnite&oldid=838517375,"Fortnite is set in contemporary Earth, where the sudden appearance of a worldwide storm causes 98% of the world's population to disappear, and zombie-like creatures rise to attack the remainder. Considered by Epic as a cross between Minecraft and Left 4 Dead , Fortnite has up to four players cooperating on various missions on randomly-generated maps to collect resources, build fortifications around defensive objectives that are meant to help fight the storm and protect survivors, and construct weapons and traps to engage in combat with waves of these creatures that attempt to destroy the objectives. Players gain rewards through these missions to improve their hero characters, support teams, and arsenal of weapon and trap schematics to be able to take on more difficult missions. The game is supported through microtransactions to purchase in-game currency that can be used towards these upgrades.",
which mode is used for short wave broadcast service,Shortwave radio,https://en.wikipedia.org//w/index.php?title=Shortwave_radio&oldid=838127903,"Shortwave radio is radio transmission using shortwave radio frequencies . There is no official definition of the band, but the range always includes all of the high frequency band (HF) , and generally extends from 1.7–30 MHz (176.3–10.0 m); from the high end of the medium frequency band (MF) just above the mediumwave AM broadcast band, to the end of the HF band .",
who wrote the first declaration of human rights,Cyrus Cylinder,https://en.wikipedia.org//w/index.php?title=Cyrus_Cylinder&oldid=836606627,"The Cylinder's text has traditionally been seen by biblical scholars as corroborative evidence of Cyrus' policy of the repatriation of the Jewish people following their Babylonian captivity (an act that the Book of Ezra attributes to Cyrus ), as the text refers to the restoration of cult sanctuaries and repatriation of deported peoples. This interpretation has been disputed, as the text identifies only Mesopotamian sanctuaries, and makes no mention of Jews, Jerusalem, or Judea. The Cylinder has also been referred to by Mohammad Reza Pahlavi , the last Shah of Iran as the first declaration of universal human rights , a view rejected by some historians as anachronistic and a misunderstanding of the Cylinder's generic nature as a typical statement made by a new monarch at the beginning of his reign. Neil MacGregor , Director of the British Museum, has stated that the cylinder was ""the first attempt we know about running a society, a state with different nationalities and faiths—a new kind of statecraft."" It was adopted as a national symbol of Iran by the Imperial State which put it on display in Tehran in 1971 to commemorate 2,500 year celebration of the Persian Empire . On October 14, the Mohammad Reza Shah's sister, Princess Ashraf Pahlavi , presented the United Nations Secretary General U Thant with a replica of the Cylinder. The princess asserted that ""the heritage of Cyrus was the heritage of human understanding, tolerance, courage, compassion and, above all, human liberty"".",
who was the governor general of india when country became independent,Governor-General of India,https://en.wikipedia.org//w/index.php?title=Governor-General_of_India&oldid=833230854,"India and Pakistan acquired independence in 1947, but Governors-General continued to be appointed over each nation until republican constitutions were written. Louis Mountbatten, 1st Earl Mountbatten of Burma remained Governor-General of India for some time after independence, but the two nations were otherwise headed by native Governors-General. India became a secular republic in 1950; Pakistan became an Islamic one in 1956.","Louis Mountbatten, 1st Earl Mountbatten of Burma"
who is the owner of reading football club,Reading F.C.,https://en.wikipedia.org//w/index.php?title=Reading_F.C.&oldid=819311942,"Reading Full name Reading Football Club Nickname(s) The Royals Founded 1871 ; 147 years ago ( 1871 ) Ground Madejski Stadium Ground Capacity 24,161 Owner Dai Yongge and Dai Xiuli (majority) Chairman Sir John Madejski Manager Jaap Stam League Championship 2016–17 Championship, 3rd Website Club website Home colours Away colours Current season",Dai Yongge and Dai Xiuli (majority)
what happens to the rbc in acute hemolytic reaction,Acute hemolytic transfusion reaction,https://en.wikipedia.org//w/index.php?title=Acute_hemolytic_transfusion_reaction&oldid=821817747,"It is also known as an ""immediate hemolytic transfusion reaction"". This is a medical emergency as it results from rapid destruction of the donor red blood cells by host antibodies (IgG, IgM). It is usually related to ABO blood group incompatibility - the most severe of which often involves group A red cells being given to a patient with group O type blood. Properdin then binds to complement C3 in the donor blood, facilitating the reaction through the alternate pathway cascade. The donor cells also become coated with IgG and are subsequently removed by macrophages in the reticuloendothelial system (RES). Jaundice and disseminated intravascular coagulation (DIC) may also occur. The most common cause is clerical error (i.e. the wrong unit of blood being given to the patient).",
where did the first african american air force unit train,Tuskegee Airmen,https://en.wikipedia.org//w/index.php?title=Tuskegee_Airmen&oldid=838231620,"All black military pilots who trained in the United States trained at Moton Field , the Tuskegee Army Air Field, and were educated at Tuskegee University , located near Tuskegee, Alabama . The group included five Haitians from the Haitian Air Force , and one pilot from Trinidad . . It also included a Hispanic or Latino airman born in the Dominican Republic .",
where does the saying like a boss come from,Like a Boss,https://en.wikipedia.org//w/index.php?title=Like_a_Boss&oldid=816720124," Like a Boss  is a song written and recorded by comedy hip hop troupe The Lonely Island for their debut studio album Incredibad . The song is a parody of the first official single from Slim Thug 's first album Already Platinum , also named ""Like a Boss"". The song had multiple versions, including an audio-only that did not have the celebrity interviewer and a clean version that was produced in both audio and video. In 2011 it was also subject to a lawsuit from the producers of the song who claimed they never received proper compensation for their work.",
what is the most current adobe flash player version,Adobe Flash Player,https://en.wikipedia.org//w/index.php?title=Adobe_Flash_Player&oldid=821558952,"Adobe Flash Player Original author(s) FutureWave Macromedia Developer(s) Adobe Systems Initial release 1996 ; 22 years ago ( 1996 ) Stable release(s) [±] Windows, macOS, Linux, Chrome OS 28.0.0.137 / January 9, 2018 ; 16 days ago ( 2018-01-09 ) Android 4.0.x 11.1.115.81 / September 10, 2013 ; 4 years ago ( 2013-09-10 ) Android 2.x and 3.x 11.1.111.73 / September 10, 2013 ; 4 years ago ( 2013-09-10 ) Solaris 11.2.202.223 / March 28, 2012 ; 5 years ago ( 2012-03-28 ) Preview release(s) [±] Windows, macOS, Linux, Chrome OS 28.0.0.152 Beta / January 24, 2018 ; 1 day ago ( 2018-01-24 ) Written in C++ Operating system Windows , macOS , Linux , Chrome OS , Solaris , BlackBerry Tablet OS , Android , and Pocket PC Platform Web browsers and ActiveX -based software Available in Chinese Simplified, Chinese Traditional, English, French, German, Italian, Japanese, Polish, Russian, Spanish, Korean, and Turkish Type Run-time environment , Media player , and Browser extension License Freeware Website www .adobe .com /products /flashplayer .html",
swan lake the sleeping beauty and the nutcracker are three famous ballets by,The Sleeping Beauty (ballet),https://en.wikipedia.org//w/index.php?title=The_Sleeping_Beauty_(ballet)&oldid=820890862,Ballets by Pyotr Ilyich Tchaikovsky Swan Lake (1876) Sleeping Beauty (1889) The Nutcracker (1892) List of all compositions v t e,Pyotr Ilyich Tchaikovsky
how many episodes are there in dragon ball z,List of Dragon Ball Z episodes,https://en.wikipedia.org//w/index.php?title=List_of_Dragon_Ball_Z_episodes&oldid=836279411,"Dragon Ball Z ( ドラゴンボールゼット , Doragon Bōru Zetto , commonly abbreviated as DBZ ) is the long-running anime sequel to the Dragon Ball TV series, adapted from the final twenty-six volumes of the Dragon Ball manga written by Akira Toriyama . The manga portion of the series debuted in Weekly Shōnen Jump in October 4, 1988 and lasted until 1995; the anime adaptation premiered in Japan on Fuji Television on April 26, 1989, taking over its predecessor's time slot, and ran until its end on January 31, 1996, lasting 291 episodes in Japan, and 276 episodes in the United States originally, although all 291 episodes were later broadcast when content from the first 67 episodes was restored.",291
cast of law & order special victim unit,Law & Order: Special Victims Unit,https://en.wikipedia.org//w/index.php?title=Law_%26_Order:_Special_Victims_Unit&oldid=822138652,"Cast Character Rank/Position Seasons Notes Regular Recurring Guest Christopher Meloni Elliot Stabler Detective 1–12 [O 1] Mariska Hargitay Olivia Benson Lieutenant 1– [N 1] [O 2] Richard Belzer John Munch DA Investigator 1–15 15, 17 [N 2] Dann Florek Donald Cragen Captain 1–15 16 [N 3] Michelle Hurd Monique Jeffries Detective 1–2 1 Stephanie March Alexandra Cabot Assistant District Attorney 2–5, 11 2, 10, 13 6 Ice-T Odafin ""Fin"" Tutuola Detective 2– Tamara Tunie Melinda Warner Medical Examiner 7–12 2–6, 13–17 19 B. D. Wong George Huang FBI Special Agent 4–12 2–3 13–15, 17 [N 4] Diane Neal Casey Novak Senior Assistant District Attorney 5–9 13 12 Adam Beach Chester Lake Detective 9 8 Michaela McManus Kim Greylek Assistant District Attorney 10 Danny Pino Nick Amaro Detective 13–16 Kelli Giddish Amanda Rollins Detective 13– Raúl Esparza Rafael Barba Assistant District Attorney 15– 14 Peter Scanavino Dominick Carisi Jr. Detective 16– 16",
what is the total eclipse of the heart video about,Total Eclipse of the Heart,https://en.wikipedia.org//w/index.php?title=Total_Eclipse_of_the_Heart&oldid=822305104,"The music video for ""Total Eclipse of the Heart"" was directed by Russell Mulcahy and was filmed on location at the Holloway Sanatorium , a large Victorian Gothic hospital near Virginia Water , Surrey , England. The video features Bonnie Tyler clad in white, dreaming or fantasizing about her students in a boys' boarding school . Young men are seen dancing and participating in various school activities and singing in a choir.",
are all firestone tires made in the usa,Firestone Tire and Rubber Company,https://en.wikipedia.org//w/index.php?title=Firestone_Tire_and_Rubber_Company&oldid=806664689,"In 1918, Firestone Tire and Rubber Company of Canada was incorporated in Hamilton, Ontario and in 1922, the first Canadian-made tire rolled off the line on September 15. During the 1920s, Firestone produced the Oldfield tire, named for racing driver Barney Oldfield .",
who designed the garden city of new earswick,New Earswick,https://en.wikipedia.org//w/index.php?title=New_Earswick&oldid=826057861,"As a result of the report, Joseph Rowntree's conviction that it must be possible to provide better housing for people on low incomes led him to acquire 150 acres of land near the village of Earswick, two and a half miles to the north of the centre of York. The planner Raymond Unwin and the architect Barry Parker were commissioned to produce an overall plan for a new 'garden' village and the detailed designs for its first houses. They also designed the garden cities of Letchworth and Welwyn Garden City .",
what is the first step in the evolution of the eye,Evolution of the eye,https://en.wikipedia.org//w/index.php?title=Evolution_of_the_eye&oldid=838517245,"The earliest predecessors of the eye were photoreceptor proteins that sense light, found even in unicellular organisms, called "" eyespots "". Eyespots can only sense ambient brightness: they can distinguish light from dark, sufficient for photoperiodism and daily synchronization of circadian rhythms . They are insufficient for vision, as they cannot distinguish shapes or determine the direction light is coming from. Eyespots are found in nearly all major animal groups, and are common among unicellular organisms, including euglena . The euglena's eyespot, called a stigma , is located at its anterior end. It is a small splotch of red pigment which shades a collection of light sensitive crystals. Together with the leading flagellum, the eyespot allows the organism to move in response to light, often toward the light to assist in photosynthesis , and to predict day and night, the primary function of circadian rhythms. Visual pigments are located in the brains of more complex organisms, and are thought to have a role in synchronising spawning with lunar cycles. By detecting the subtle changes in night-time illumination, organisms could synchronise the release of sperm and eggs to maximise the probability of fertilisation. [ citation needed ]",
where is the tv show the curse of oak island filmed,The Curse of Oak Island,https://en.wikipedia.org//w/index.php?title=The_Curse_of_Oak_Island&oldid=832882458,"The Curse of Oak Island follows brothers Marty and Rick Lagina, originally from Kingsford, Michigan , through their efforts to find the speculated treasure or historical artifacts believed to be on Oak Island . The series discusses the history of the island, recent discoveries, theories, and prior attempts to investigate the site. Areas of interest include the ""Money Pit"", Borehole 10-x , Smith's Cove, ""Nolan's Cross"", the ""Hatch"", the ""Watchtower"" and the ""Swamp"".",Oak Island
where is gall bladder situated in human body,Gallbladder,https://en.wikipedia.org//w/index.php?title=Gallbladder&oldid=821194740,"In vertebrates , the gallbladder is a small hollow organ where bile is stored and concentrated before it is released into the small intestine . In humans, the pear-shaped gallbladder lies beneath the liver , although the structure and position of the gallbladder can vary significantly among animal species. It receives and stores bile, produced by the liver, via the common hepatic duct , and releases it via the common bile duct into the duodenum , where the bile helps in the digestion of fats .",beneath the liver
who is the current director of the us mint,Director of the United States Mint,https://en.wikipedia.org//w/index.php?title=Director_of_the_United_States_Mint&oldid=836791366,"The Director of the United States Mint is the head of the United States Mint . The position is currently vacant. Since January 20, 2017, the senior career official at the Mint has been Acting Principal Deputy Director David Motl.",
meaning of joy to the world by three dog night,Joy to the World (Three Dog Night song),https://en.wikipedia.org//w/index.php?title=Joy_to_the_World_(Three_Dog_Night_song)&oldid=835489072,"The song, which has been described by members of Three Dog Night as a ""kid's song"" and a ""silly song"", topped the main singles charts in North America, was certified gold by the RIAA , and has since been covered by multiple artists.",
what is the main mineral in lithium batteries,Lithium,https://en.wikipedia.org//w/index.php?title=Lithium&oldid=819518707,"Late in the 20th century, lithium became an important component of battery electrolytes and electrodes, because of its high electrode potential . Because of its low atomic mass , it has a high charge- and power-to-weight ratio. A typical lithium-ion battery can generate approximately 3 volts per cell, compared with 2.1 volts for lead-acid or 1.5 volts for zinc-carbon cells . Lithium-ion batteries, which are rechargeable and have a high energy density , should not be confused with lithium batteries , which are disposable ( primary ) batteries with lithium or its compounds as the anode . Other rechargeable batteries that use lithium include the lithium-ion polymer battery , lithium iron phosphate battery , and the nanowire battery .",
right to property according to the constitution of india is a,Fundamental rights in India,https://en.wikipedia.org//w/index.php?title=Fundamental_rights_in_India&oldid=837658190,"The provisions relating to the right to property were changed a number of times. The Forty-Fourth Amendment of 1978 deleted the right to property from the list of fundamental rights A new provision, Article 300-A, was added to the constitution, which provided that ""no person shall be deprived of his property save by authority of law"". Thus if a legislature makes a law depriving a person of his property, there would be no obligation on the part of the State to pay anything as compensation. The aggrieved person shall have no right to move the court under Article 32. Thus, the right to property is no longer a fundamental right, though it is still a constitutional right. If the government appears to have acted unfairly, the action can be challenged in a court of law by aggrieved citizens.",constitutional right
who is the president of usa right now,President of the United States,https://en.wikipedia.org//w/index.php?title=President_of_the_United_States&oldid=837764569,"Donald Trump is the 45th and current president, inaugurated on January 20, 2017.",Donald Trump
what is the use of adobe flash cs3 professional,Adobe Flash,https://en.wikipedia.org//w/index.php?title=Adobe_Flash&oldid=821675124,"In 2007, Adobe's first version release was Adobe Flash CS3 Professional , the ninth major version of Flash. It introduced the ActionScript 3.0 programming language, which supported modern programming practices and enabled business applications to be developed with Flash. Adobe Flex Builder (built on Eclipse ) targeted the enterprise application development market, and was also released the same year. Flex Builder included the Flex SDK, a set of components that included charting, advanced UI, and data services ( Flex Data Services ).",
did anyone die from ebola in the us,Ebola virus cases in the United States,https://en.wikipedia.org//w/index.php?title=Ebola_virus_cases_in_the_United_States&oldid=834124413,"In December 2014, Ebola virus cases in the United States occurred due to four laboratory-confirmed cases of Ebola virus disease (commonly known as ""Ebola"") in the United States . Eleven cases have been reported, including these four cases and seven cases medically evacuated from other countries; the first was reported in September 2014. Nine of the people contracted the disease outside the US and traveled into the country, either as regular airline passengers or as medical evacuees ; of those nine, two died. Two people have contracted Ebola in the United States. Both were nurses who treated an Ebola patient; both have recovered.",
what part of the brain is in the middle cranial fossa,Middle cranial fossa,https://en.wikipedia.org//w/index.php?title=Middle_cranial_fossa&oldid=808415657,It houses the temporal lobes of the brain and the pituitary gland . A middle fossa craniotomy is one means to surgically remove acoustic neuromas ( vestibular schwannoma ) growing within the internal auditory canal of the temporal bone.,the temporal lobes | the pituitary gland
who died in the plane crash greys anatomy,Flight (Grey's Anatomy),https://en.wikipedia.org//w/index.php?title=Flight_(Grey%27s_Anatomy)&oldid=804214813," Flight  is the twenty-fourth and final episode of the eighth season of the American television medical drama Grey's Anatomy , and the show's 172nd episode overall. It was written by series creator Shonda Rhimes , and directed by Rob Corn . The episode was originally broadcast on the American Broadcasting Company (ABC) in the United States on May 17, 2012. In the episode, six doctors from Seattle Grace Mercy West Hospital who are victims of an aviation accident fight to stay alive, but Dr. Lexie Grey ( Chyler Leigh ) ultimately dies. Other storylines occur in Seattle where Dr. Richard Webber ( James Pickens, Jr. ) plans his annual dinner for the departing residents , Dr. Owen Hunt ( Kevin McKidd ) fires Dr. Teddy Altman ( Kim Raver ), and Dr. Miranda Bailey ( Chandra Wilson ) gets engaged.",Dr. Lexie Grey
where do they grow hops in the us,Hops,https://en.wikipedia.org//w/index.php?title=Hops&oldid=836763018,"Important production centres today are the Hallertau in Germany (more hop-growing area than any other country as of 2006), the Yakima ( Washington ) and Willamette (Oregon) valleys, and western Canyon County, Idaho (including the communities of Parma , Wilder , Greenleaf , and Notus ). The principal production centres in the UK are in Kent (which produces Kent Goldings hops), Herefordshire , and Worcestershire . Essentially all of the harvested hops are used in beer making.",
who plays nikki in need for speed carbon,Emmanuelle Vaugier,https://en.wikipedia.org//w/index.php?title=Emmanuelle_Vaugier&oldid=836763004,Vaugier appeared in Need for Speed: Carbon as Nikki. She is the girlfriend of the antagonist in the game (love interest of the protagonist).,
what's the dog's name on tom and jerry,List of Tom and Jerry characters,https://en.wikipedia.org//w/index.php?title=List_of_Tom_and_Jerry_characters&oldid=812821786,"Spike , occasionally referred to as Butch or Killer, is a stern but occasionally dumb American bulldog who is particularly disapproving of cats, but a softie when it comes to mice (though in his debut appearance, Dog Trouble , Spike goes after both Tom and Jerry), and later, his son Tyke . In the shorts Jerry would often try to get Tom in trouble with Spike making him a shoo-in for a beating from the bulldog. Spike has a few weaknesses that Tom tries to capitalize upon: his possessiveness about his bone and his ticklishness. He made his first appearance in the 1942 Tom and Jerry cartoon Dog Trouble , and his first speaking role was in 1944's The Bodyguard , where he was voiced by Billy Bletcher up until 1949, from which point he was voiced by Daws Butler . Unlike his father Spike, Tyke does not speak. He only communicates by yapping, whimpering, growling, facial expressions and wagging his tail. In Tom and Jerry Kids , Tyke does have a speaking role in the program and is the first time that viewers were able to hear Tyke speak. Spike is very protective towards his son and gets very angry at Tom if Tyke is bothered or harmed. Although Tyke has spoken in Tom and Jerry Kids , he has laughed in one Tom and Jerry short. After Daws Butler, Maurice LaMarche , Frank Welker , John DiMaggio , Michael Donovan , Phil LaMarr and currently Rick Zieff would all perform Spike's voice. Tyke's vocal effects are provided by Frank Welker and speaking roles by Patric Zimmerman .",Spike
where was the music video what ifs filmed,What Ifs,https://en.wikipedia.org//w/index.php?title=What_Ifs&oldid=838232791,"The official music video for the song was directed by P.R. Brown and produced by Steve Lamar. The video was filmed along the Californian coast at The Inn at Newport Ranch, a resort and cattle ranch to the north of San Francisco. It features Brown and his duet partner Lauren Alaina singing along the coast. It was released on May 14, 2017. An earlier lyric video was first released on May 4, 2017, and shows Brown and Alaina cruising down a road.","along the Californian coast at The Inn at Newport Ranch, a resort and cattle ranch to the north of San Francisco"
