question,document_title,document_url,long_answer_text,short_answers
in which regions are most of africa petroleum and natural gas found,Petroleum industry in Nigeria,https://en.wikipedia.org//w/index.php?title=Petroleum_industry_in_Nigeria&oldid=834244345,"Nigeria is the largest oil and gas producer in Africa. Crude oil from the delta basin comes in two types: light, and comparatively heavy – the lighter around 36 gravity and the heavier, 20–25 gravity. Both types are paraffinic and low in sulfur.",Nigeria
where does kylo ren's name come from,Kylo Ren,https://en.wikipedia.org//w/index.php?title=Kylo_Ren&oldid=822171546,"Abrams told Empire in August 2015, ""Kylo Ren is not a Sith . He works under Supreme Leader Snoke, who is a powerful figure on the Dark Side of the Force."" Abrams had previously told Entertainment Weekly that the character, ""came to the name Kylo Ren when he joined a group called the Knights of Ren."" Robbie Collin of The Telegraph described Ren as ""a hot-headed, radicalised Dark Side jihadi, whose red lightsaber splutters and crackles as violently as his temper"". Abrams noted, ""The lightsaber is something that he built himself, and is as dangerous and as fierce and as ragged as the character."" The Telegraph also explains that Ren's wild and erratic temper and ""angsty"" instability make him dangerous. Melissa Leon of The Daily Beast describes Ren's use of the Force as ""formidable"", citing his ability to stop a blaster shot mid-air, immobilize victims and probe their minds against their will.",
how many countries are a part of opec,OPEC,https://en.wikipedia.org//w/index.php?title=OPEC&oldid=834259589,"Organization of the Petroleum Exporting Countries ( OPEC , / ˈ oʊ p ɛ k / OH -pek , or OPEP in several other languages) is an intergovernmental organization of 14 nations as of February 2018, founded in 1960 in Baghdad by the first five members ( Iran , Iraq , Kuwait , Saudi Arabia , and Venezuela ), and headquartered since 1965 in Vienna , Austria . As of 2016, the 14 countries accounted for an estimated 44 percent of global oil production and 73 percent of the world's ""proven"" oil reserves , giving OPEC a major influence on global oil prices that were previously determined by American-dominated multinational oil companies .",14
what type of car is a jeep considered,Jeep,https://en.wikipedia.org//w/index.php?title=Jeep&oldid=837725447,"Jeep's current product range consists solely of sport utility vehicles and off-road vehicles , but has also included pickup trucks in the past. Some of Jeep's vehicles, such as the Grand Cherokee and the Wagoneer , reach into the luxury segment. Jeep sold 1.4 million SUVs globally in 2016, up from 500,000 in 2008, two-thirds of which in North America, and was Fiat-Chrysler's best selling brand in the U.S. during the first half of 2017. In the U.S. alone, over 2400 dealerships hold franchise rights to sell Jeep-branded vehicles, and if Jeep were spun off into a separate company, it is estimated to be worth between $22 and $33.5 billion — slightly more than all of FCA (US).",
where are the coastal plains of india situated,Eastern coastal plains,https://en.wikipedia.org//w/index.php?title=Eastern_coastal_plains&oldid=812520937,"The Eastern Coastal Plains refers to a wide stretch of landmass of India , lying between the Eastern Ghats and the Bay of Bengal . It is wider and leveled than the western coastal plains and stretches from Tamil Nadu in the south to West Bengal in the north through Andhra Pradesh and Odisha . Chilka Lake is a brackish water lake along the eastern coastal plain. It lies in the state of Odisha and stretches to the south of the Mahanadi Delta.",between the Eastern Ghats and the Bay of Bengal
what is the name of manchester united stadium,Manchester United F.C.,https://en.wikipedia.org//w/index.php?title=Manchester_United_F.C.&oldid=838521139,"Manchester United Football Club is a professional football club based in Old Trafford, Greater Manchester , England , that competes in the Premier League , the top flight of English football . Nicknamed ""the Red Devils"", the club was founded as Newton Heath LYR Football Club in 1878, changed its name to Manchester United in 1902 and moved to its current stadium, Old Trafford , in 1910.",Old Trafford
who played the mother in the black stallion,The Black Stallion (film),https://en.wikipedia.org//w/index.php?title=The_Black_Stallion_(film)&oldid=836268326,"Teri Garr as Mrs. Ramsay, Alec's mother",Teri Garr
who sings the theme song for the proud family,The Proud Family (soundtrack),https://en.wikipedia.org//w/index.php?title=The_Proud_Family_(soundtrack)&oldid=638462881,"The Proud Family is a soundtrack album for the show of the same name . A combination of both original tunes by the characters in the show, popular hits by popular music artists such as Alicia Keys , Jhené Aiko , India Arie , and Solange Knowles & Destiny's Child (who perform the theme song), and classic soul music from artists such as Aretha Franklin and The O'Jays .",Destiny's Child
who wrote cant get you out of my head lyrics,Can't Get You Out of My Head,https://en.wikipedia.org//w/index.php?title=Can%27t_Get_You_Out_of_My_Head&oldid=838110772,"Can't Get You Out of My Head is a song recorded by Australian singer Kylie Minogue for her eighth studio album, titled Fever , which she released in 2001. The song was released in Australia by Parlophone as the lead single from the album on 8 September 2001. It was released on 17 September 2001 in the United Kingdom. In the United States, the single was released on 18 February 2002. Jointly written, composed, and produced by Cathy Dennis and Rob Davis , ""Can't Get You Out of My Head"" is a midtempo dance-pop song which lyrically details its narrator's obsession towards her lover. The song is famous for its ""la la la"" hook.",Cathy Dennis | Rob Davis
who did shakespeare write his play hamlet for,Hamlet,https://en.wikipedia.org//w/index.php?title=Hamlet&oldid=838253610,"The story of Shakespeare's Hamlet was derived from the legend of Amleth , preserved by 13th-century chronicler Saxo Grammaticus in his Gesta Danorum , as subsequently retold by the 16th-century scholar François de Belleforest . Shakespeare may also have drawn on an earlier Elizabethan play known today as the Ur-Hamlet , though some scholars believe he himself wrote the Ur-Hamlet , later revising it to create the version of Hamlet we now have. He almost certainly wrote his version of the title role for his fellow actor, Richard Burbage , the leading tragedian of Shakespeare's time. In the 400 years since its inception, the role has been performed by numerous highly acclaimed actors in each successive century.","his fellow actor, Richard Burbage"
are there many copies of sir gawain and the green knight,Sir Gawain and the Green Knight,https://en.wikipedia.org//w/index.php?title=Sir_Gawain_and_the_Green_Knight&oldid=837444628,"The poem survives in a single manuscript, the Cotton Nero A.x. , which also includes three religious narrative poems : Pearl , Purity and Patience . All are thought to have been written by the same unknown author, dubbed the "" Pearl Poet "" or ""Gawain Poet"", since all four are written in a North West Midland dialect of Middle English.",
where does the story the great gatsby take place,The Great Gatsby,https://en.wikipedia.org//w/index.php?title=The_Great_Gatsby&oldid=821432789,"The Great Gatsby is a 1925 novel written by American author F. Scott Fitzgerald that follows a cast of characters living in the fictional town of West Egg on prosperous Long Island in the summer of 1922. The story primarily concerns the young and mysterious millionaire Jay Gatsby and his quixotic passion and obsession for the beautiful former debutante Daisy Buchanan. Considered to be Fitzgerald's magnum opus , The Great Gatsby explores themes of decadence , idealism , resistance to change, social upheaval, and excess, creating a portrait of the Jazz Age or the Roaring Twenties that has been described as a cautionary tale regarding the American Dream .",the fictional town of West Egg on prosperous Long Island
how did rogue get super strength and flight,Rogue (comics),https://en.wikipedia.org//w/index.php?title=Rogue_(comics)&oldid=817574960,"As a young woman, Rogue permanently absorbed the superhuman powers and the psyche of Carol Danvers , the original Ms. Marvel . This provided her with superhuman strength, stamina, durability, reflexes, speed and a 7th sense. She was able to repel bullets and fly at sub-sonic speeds, much like Ms. Marvel could. In addition, she possessed an amalgamated mutant human/Kree physiology that rendered her resistant to most toxins and poisons, with the added effect of making her virtually invulnerable.",
why did government sponsored surveys and land acts encourage migration to the west,Homestead Acts,https://en.wikipedia.org//w/index.php?title=Homestead_Acts&oldid=815139338,"The Homestead Acts were several United States federal laws that gave an applicant ownership of land, typically called a "" homestead ,"" at no cost. In all, more than 270 million acres of public land, or nearly 10% of the total area of the U.S., was given away free to 1.6 million homesteaders; most of the homesteads were west of the Mississippi River .",
who turned out to be the mother on how i met your mother,The Mother (How I Met Your Mother),https://en.wikipedia.org//w/index.php?title=The_Mother_(How_I_Met_Your_Mother)&oldid=802354471,"Tracy McConnell , better known as "" The Mother "", is the title character from the CBS television sitcom How I Met Your Mother . The show, narrated by Future Ted , tells the story of how Ted Mosby met The Mother. Tracy McConnell appears in 8 episodes from "" Lucky Penny "" to "" The Time Travelers "" as an unseen character ; she was first seen fully in "" Something New "" and was promoted to a main character in season 9 . The Mother is played by Cristin Milioti .",Tracy McConnell
list of states of australia and their capitals,List of Australian capital cities,https://en.wikipedia.org//w/index.php?title=List_of_Australian_capital_cities&oldid=813441772,"State and Territory Capitals of Australia Jurisdiction Capital City Population State/Territory Population Date of statehood Capital since Image Australia and Australian Capital Territory Canberra 435,019 403,468 Must remain a territory as per s.125 of the Australian Constitution [N 1] 1913 View of Civic from Mount Ainslie , with Telstra Tower in the background New South Wales Sydney 5,029,768 7,759,274 1788 1788 Skyline of the Sydney central business district Victoria Melbourne 4,725,316 6,179,249 1851 1851 The Melbourne skyline on the Yarra River Queensland Brisbane 2,360,241 4,848,877 1859 1860 Brisbane's CBD, with the Story Bridge in the foreground Western Australia Perth 2,022,044 2,558,951 1829 1829 View of Perth CBD skyline South Australia Adelaide 1,324,279 1,713,054 1836 1836 View of Adelaide Skyline . Tasmania Hobart 224,462 517,588 1825 1826 View of the Hobart downtown district and Mount Wellington from Constitution Dock Northern Territory Darwin 145,916 245,740 Has not attained Statehood [N 2] 1911 View of Darwin CBD",
who took over for batman when his back was broken,Batman: Knightfall,https://en.wikipedia.org//w/index.php?title=Batman:_Knightfall&oldid=836456522," Knightfall  is a 1993-1994 Batman story arc published by DC Comics . It consists of a trilogy of storylines that ran from 1993 to 1994, consisting of ""Knightfall"", "" Knightquest "", and "" KnightsEnd "". [note 1] The story takes place over approximately six months. Bruce Wayne (Batman) suffers burnout and is systematically assaulted and crippled by a ""super steroid ""-enhanced genius named Bane . Wayne is replaced as Batman by an apprentice named Jean-Paul Valley (a.k.a. Azrael), who becomes increasingly violent and unstable, tarnishing Batman's reputation. Eventually, Wayne is healed through paranormal means, and reclaims his role as Batman.",Jean-Paul Valley (a.k.a. Azrael)
what is the corporate tax rate in great britain,United Kingdom corporation tax,https://en.wikipedia.org//w/index.php?title=United_Kingdom_corporation_tax&oldid=811063149,"Originally introduced as a classical tax system, in which companies were subject to tax on their profits and companies' shareholders were also liable to income tax on the dividends that they received, the first major amendment to corporation tax saw it move to a dividend imputation system in 1973, under which an individual receiving a dividend became entitled to an income tax credit representing the corporation tax already paid by the company paying the dividend. The classical system was reintroduced in 1999, with the abolition of advance corporation tax and of repayable dividend tax credits. Another change saw the single main rate of tax split into three. Tax competition between jurisdictions reduced the main corporate tax rate from 28% in 2008-2010 to a flat rate of 20% as of April 2015.",a flat rate of 20%
what is the meaning of the name sinead,Sinéad,https://en.wikipedia.org//w/index.php?title=Sin%C3%A9ad&oldid=792745813,"Sinéad ( / ʃ ɪ ˈ n eɪ d / shi- NADE ; Irish pronunciation: [ˈʃɪnʲeːd̪ˠ] or [ʃɪˈnʲeːd̪ˠ] ), is an Irish feminine name. It is derived from the French Jeanette , which is cognate to the English Janet , itself a feminine form of the Hebrew Yohannan , ""God forgave/God gratified"". In English , Sinéad is also commonly spelled Sinead . The name is generally translated into English as either Jane or Jennifer , or as the female version of the Scottish name Jean .",God forgave/God gratified
where does the autobahn have no speed limit,Autobahn,https://en.wikipedia.org//w/index.php?title=Autobahn&oldid=837119844,"German autobahns have no federally mandated speed limit for some classes of vehicles. However, limits are posted (and enforced) in areas that are urbanized, substandard, accident-prone, or under construction. On speed-unrestricted stretches, an advisory speed limit ( Richtgeschwindigkeit ) of 130 kilometres per hour (81 mph) applies. While going faster is not illegal as such in the absence of a speed limit, it can cause an increased liability in the case of an accident; courts have ruled that an ""ideal driver"" who is exempt from absolute liability for ""inevitable"" tort under the law would not exceed Richtgeschwindigkeit .",
what network is showing the monday night football game,Monday Night Football,https://en.wikipedia.org//w/index.php?title=Monday_Night_Football&oldid=819059601,"ESPN Monday Night Football (abbreviated as MNF and also known as ESPN Monday Night Football on ABC for rare live special broadcast) is a live television broadcast of weekly National Football League (NFL) games on ESPN in the United States. From 1970 to 2005 , it aired on sister broadcast network ABC . Monday Night Football was, along with Hallmark Hall of Fame and the Walt Disney anthology television series , one of the longest-running prime time programs ever on commercial network television, and one of the highest-rated, particularly among male viewers. MNF is preceded on air by Monday Night Countdown served by Applebee's .",ESPN
what is the form of mozart symphony no 40,Symphony No. 40 (Mozart),https://en.wikipedia.org//w/index.php?title=Symphony_No._40_(Mozart)&oldid=825476175,"Symphony No. 40 in G minor , KV . 550 was written by Wolfgang Amadeus Mozart in 1788. It is sometimes referred to as the ""Great G minor symphony"", to distinguish it from the ""Little G minor symphony"", No. 25 . The two are the only extant minor key symphonies Mozart wrote.",
what was the city of beijing previously known as,Beijing,https://en.wikipedia.org//w/index.php?title=Beijing&oldid=838137684,"Beijing ( / b eɪ ˈ dʒ ɪ ŋ / ; Mandarin: [pèi.tɕíŋ] ( listen ) ), formerly romanized as Peking , is the capital of the People's Republic of China , the world's second most populous city proper , and most populous capital city. The city, located in northern China , is governed as a direct-controlled municipality under the national government with 16 urban, suburban, and rural districts . Beijing Municipality is surrounded by Hebei Province with the exception of neighboring Tianjin Municipality to the southeast; together the three divisions form the Jingjinji metropolitan region and the national capital region of China.",Peking
when is the fourth movie of the divergent series coming out,The Divergent Series,https://en.wikipedia.org//w/index.php?title=The_Divergent_Series&oldid=837818050,"The first installment, Divergent (2014), grossed over $288 million worldwide, while the second installment, The Divergent Series: Insurgent (2015), grossed over $297 million worldwide. Insurgent was also the first Divergent film to be released in IMAX 3D . The third installment, The Divergent Series: Allegiant (2016), grossed $179 million. Thus, the first three films of the series have grossed over $765 million worldwide. A fourth film, The Divergent Series: Ascendant was never made, due to Allegiant's poor showing at the box office.",
where is republic of doyle supposed to take place,Republic of Doyle,https://en.wikipedia.org//w/index.php?title=Republic_of_Doyle&oldid=837889899,"Republic of Doyle is a Canadian comedy-drama television series set in St. John's , Newfoundland and Labrador which aired on CBC Television from January 6, 2010 to December 10, 2014.","St. John's , Newfoundland and Labrador"
what is the sentencing reform act of 1984,Sentencing Reform Act,https://en.wikipedia.org//w/index.php?title=Sentencing_Reform_Act&oldid=813388767,"The Sentencing Reform Act , part of the Comprehensive Crime Control Act of 1984 , was a U.S. federal statute intended to increase consistency in United States federal sentencing. It established the United States Sentencing Commission . It also abolished federal parole , except for persons convicted under federal law before November 1, 1987, persons convicted under District of Columbia law, "" transfer treaty "" inmates, persons who violated military law who are in federal civilian prisons, and persons who are defendants in state cases and who are under the U.S. Marshals Service Witness Protection Program .",
who will take the throne after the queen dies,Succession to the British throne,https://en.wikipedia.org//w/index.php?title=Succession_to_the_British_throne&oldid=838504174,"Queen Elizabeth II is the sovereign, and her heir apparent is her eldest son, Charles, Prince of Wales . Next in line after him is Prince William, Duke of Cambridge , the Prince of Wales's elder son. Third in line is Prince George , the eldest child of the Duke of Cambridge, followed by his sister, Princess Charlotte and younger brother, Prince Louis . Sixth in line is Prince Henry of Wales , the younger son of the Prince of Wales. Any of the first six in line marrying without the sovereign's consent would be disqualified from succession.","Charles, Prince of Wales"
who is the girl in green day 21 guns,21 Guns (song),https://en.wikipedia.org//w/index.php?title=21_Guns_(song)&oldid=820470590,"The video takes place with the band and the album's two protagonists Christian ( Josh Boswell ) and Gloria ( Lisa Stelly ) taking refuge in a white room after robbing a bank. The police arrive outside the room and open fire through the window, to the couple's terror. As bullets rain through the room, the band continues playing. Gloria picks up the phone and throws it into a fish tank. As the bullets continue to fly and tear apart the room, Christian and Gloria become calm and walk toward each other, unharmed by the bullets. They embrace and kiss as the room goes dark, recreating the 21st Century Breakdown cover art. As the song ends, the room lights up again, and they are still uninjured. After the room lights up, there are various shots of destruction in the room, including a shot of some of the writing on the walls. The writing includes an excerpt of the lyrics to ""21 Guns"", as well as those of the song ""See The Light"" which also appears on ""21st Century Breakdown"". The video may represent the meaning of the song in the 21st Century Breakdown story.",Lisa Stelly
who plays the voice of johnny in sing,Sing (2016 American film),https://en.wikipedia.org//w/index.php?title=Sing_(2016_American_film)&oldid=837851173,"Taron Egerton as Johnny, a teenage gorilla who wants to sing, though his father would rather have him follow his criminal footsteps.",Taron Egerton
which five year plan was affected by indo pak indo china war,Five-Year Plans of India,https://en.wikipedia.org//w/index.php?title=Five-Year_Plans_of_India&oldid=838085429,"The Third Five-year Plan, stressed agriculture and improvement in the production of wheat, but the brief Sino-Indian War of 1962 exposed weaknesses in the economy and shifted the focus towards the defence industry and the Indian Army. In 1965–1966, India fought a War with Pakistan . There was also a severe drought in 1965. The war led to inflation and the priority was shifted to price stabilisation. The construction of dams continued. Many cement and fertilizer plants were also built. Punjab began producing an abundance of wheat .",The Third Five-year Plan
who decides the number of judges in the high court,Indian High Courts Act 1861,https://en.wikipedia.org//w/index.php?title=Indian_High_Courts_Act_1861&oldid=813167323,"In every High Court, there is a Chief Justice and many other judges whose number is defined by the President of India.",
who was the pitcher who broke his arm,Dave Dravecky,https://en.wikipedia.org//w/index.php?title=Dave_Dravecky&oldid=801379748,"The following season, a cancerous desmoid tumor was found in Dravecky's pitching arm. On October 7, 1988, he underwent surgery, which removed half of the deltoid muscle in his pitching arm and froze the humerus bone in an effort to eliminate all of the cancerous cells. Doctors advised Dravecky to wait until 1990 to pitch again, but Dravecky was determined to pitch in 1989. By July 1989, he was pitching in the minors , and on August 10, he made a highly publicized return to the major leagues, pitching eight innings and defeating Cincinnati 4–3. In his following start, five days later in Montreal , Dravecky pitched three no-hit innings, but in the fifth inning, he felt a tingling sensation in his arm. In the sixth inning, he started off shaky, allowing a home run to the leadoff batter and then hitting the second batter, Andrés Galarraga . Then, on his first pitch to Tim Raines , his humerus bone snapped; the sound of it breaking could be heard throughout the stadium. Dravecky collapsed on the mound. He'd suffered a clean break midway between his shoulder and elbow, ending his season.",
how many languages do they speak in africa,Languages of Africa,https://en.wikipedia.org//w/index.php?title=Languages_of_Africa&oldid=819520369,"The total number of languages natively spoken in Africa is variously estimated (depending on the delineation of language vs. dialect ) at between 1,250 to 2,100, and by some counts at ""over 3,000"", Nigeria alone has over 500 languages (according to the count of SIL Ethnologue ), one of the greatest concentrations of linguistic diversity in the world.",
name the process of fusion of an egg with a sperm,Human fertilization,https://en.wikipedia.org//w/index.php?title=Human_fertilization&oldid=816596335,"Human fertilization is the union of a human egg and sperm , usually occurring in the ampulla of the fallopian tube . The result of this union is the production of a zygote cell, or fertilized egg, initiating prenatal development . Scientists discovered the dynamics of human fertilization in the nineteenth century.",fertilization
where is the national championship for college football played,2018 College Football Playoff National Championship,https://en.wikipedia.org//w/index.php?title=2018_College_Football_Playoff_National_Championship&oldid=822294017,"The College Football Playoff selection committee chose the semifinalists following the conclusion of the 2017 regular season. Alabama and Georgia advanced to the national championship after winning the semifinal games hosted by the Sugar Bowl and the Rose Bowl , respectively, on January 1, 2018. The championship game was played at Mercedes-Benz Stadium in Atlanta, Georgia on January 8, 2018.","Mercedes-Benz Stadium in Atlanta, Georgia"
the vascular layer of the eye is the,Uvea,https://en.wikipedia.org//w/index.php?title=Uvea&oldid=825197542,"The uvea is the vascular middle layer of the eye. It is traditionally divided into three areas, from front to back, the:",The uvea
